company,date,title,rise
삼성SDS,2019-06-10,미래 그리는 삼성전자 직책 신설,4.0
삼성SDS,2019-06-12,삼성전자 혁신전략 통합 관리 첫 에 데이비드 은 임명,2.0
삼성SDS,2019-06-13,창업 성공률 높은 사내벤처 차별화된 정부 지원 나서야,2.0
삼성SDS,2019-06-17,스타크래프트 게임도 인간 뛰어넘는 나올까,2.0
삼성SDS,2019-06-14,펀드줌인 마이다스책임투자펀드 착한경영 기업에 투자 최근 년간 % 고수익,2.0
삼성SDS,2019-06-18,공공부문 블록체인 첫 수주,2.0
삼성SDS,2019-06-19,부고 황국희씨 별세,2.0
삼성SDS,2019-06-20,덩치 큰 기업 증발공 규정 제외 논란,2.0
삼성SDS,2019-06-21,클라우드 강조하는 대형 서비스업계 영업익 개선에도 투자는 궁색,2.0
삼성SDS,2019-06-24,김상조 재벌 물류 광고회사 총수일가 지분 팔아야 종합,2.0
삼성SDS,2019-06-26,한국만의 기업환경 있는데 기업 옥죄는 김상조식 글로벌 잣대,2.0
삼성SDS,2019-06-25,김상조 경고 에 삼성 신세계 주르륵,2.0
삼성SDS,2019-06-27,삼성 김상조 쇼크 비핵심 계열사 팔아라 발언에 % 급락,2.0
삼성SDS,2019-06-28,저격수 김상조 지분매각 압박에 재계 진의파악 끙끙,2.0
삼성SDS,2019-07-01,김상조의 초강수 재계 당혹,2.0
삼성SDS,2019-07-02,근무시간 단축 효율성 높여라 스마트팩토리 주목,2.0
삼성SDS,2019-07-03,김상조 구글 애플 등 글로벌 기업 갑질 더 세밀하게 들여다 볼 것,2.0
삼성SDS,2019-07-04,김상조 해임 청와대에 청원 뿔난 삼성 소액주주들,4.0
삼성SDS,2019-07-08,애널리스트 김상조 피해 저가에 사라,0.0
삼성SDS,2019-07-10,지배구조 개편 강풍으로 바뀐다 투자자엔 기회,2.0
삼성SDS,2019-07-11,작심발언 법 개정 쌍칼 든 공정위원장,2.0
삼성SDS,2019-07-12,무료 명품강좌를 소개합니다 대 주력산업 분석 산업 한류 의 길 모색,2.0
삼성SDS,2019-07-15,김상조 삼성 주주 반발에 비상장 계열사 지목한 것,2.0
삼성SDS,2019-07-16,김상조 발언에 주가폭락 책임져라 뿔난 삼성 소액주주들 청원,2.0
삼성SDS,2019-07-17,김상조 한마디에 기업 주가 급락 책임져라 청원 봇물,2.0
삼성SDS,2019-07-18,총수에 지분 팔라던 김상조 비주력 비상장사 의미한것,2.0
삼성SDS,2019-07-19,혁신성장도 공정위가 맡겠다 는 김상조 공정거래위원장,2.0
삼성SDS,2019-07-23,김상조 비핵심계열사 지분 매각 비주력 비상장사 해당,2.0
삼성SDS,2019-07-22,김상조 혁신성장 비판받을 수 있어 허들 극복에 성패 달려,2.0
삼성SDS,2019-07-25,삼성 온라인 물류 플랫폼 시장 공략 박차,2.0
삼성SDS,2019-07-24,블록체인으로 원산지 증명 삼성 새 물류 플랫폼 출시,4.0
삼성SDS,2019-07-26,블록체인 접목한 물류서비스 삼성 첼로 스퀘어,2.0
삼성SDS,2019-07-29,삼성 블록체인 적용한 온라인 물류 플랫폼 첼로 스퀘어 공개,2.0
삼성SDS,2019-07-30,삼성 블록체인 물류플랫폼 공개,2.0
삼성SDS,2019-07-31,기업 삼성 중소기업 물류 경쟁력 강화 위한 업무협약 체결,2.0
삼성SDS,2019-08-02,김상조 총수일가 지분정리 비상장사 두고 한 말,2.0
삼성SDS,2019-08-05,디지털 트랜스포메이션 혁신이 답이다 전통의 틀을 깨고 디지털로 진화하다,0.0
삼성SDS,2019-08-09,사설 신중하지 못한 발언으로 증시 교란시킨 김상조,2.0
삼성SDS,2019-08-12,사설 김상조 공정위원장의 대기업 압박이 초래한 소액주주 반발,2.0
삼성SDS,2019-08-14,삼성 첼로스퀘어 공개 온라인 물류시장 공략,2.0
삼성SDS,2019-08-13,삼성 온라인 물류 플랫폼 첼로 스퀘어 서비스,2.0
삼성SDS,2019-08-16,마켓인사이트 김상조 압박에 대기업 비주력 계열사 매각 상장 속도내나,2.0
삼성SDS,2019-08-19,지역정보개발원 신임 원장에 지대범 초빙교수,2.0
삼성SDS,2019-08-21,데스크 칼럼 정당지지율을 정책지지율로 착각해선 안된다,2.0
삼성SDS,2019-08-22,한우이력 전자투표 부동산거래도 블록체인 한국형 시스템 개발 속도,2.0
삼성SDS,2019-08-23,삼성그룹주펀드의 추락,2.0
삼성SDS,2019-08-27,대기업 부동산관리업체 일감몰아주기 혐의 입증 왜 우리가,2.0
삼성SDS,2019-08-28,공정위 재벌개혁 고삐 일감몰아주기 근절 칼 뺐다,2.0
삼성SDS,2019-08-29,서북권 업무 상업 거점 수색역세권 달린다,0.0
삼성SDS,2019-08-30,부고 곽현숙 별세 최준배 은배 용석 모친상,4.0
삼성SDS,2019-09-02,조홍래 사장 집무실 도쿄지도로 도배하며 부동산펀드 설계 해외상품 개척 앞장,2.0
삼성SDS,2019-09-03,삼성 델 클라우드 공략 손잡았다,2.0
삼성SDS,2019-09-04,클라우드 시장 합동공략 삼성 버투스트림 맞손,2.0
삼성SDS,2019-09-05,버투스트림 국내 시장 본격 진출 미션크리티컬 클라우드 시장 공략,2.0
삼성SDS,2019-09-06,시론 업체 분리 해체가 능사 아니다,2.0
삼성SDS,2019-09-09,과거 정부 기업인 입각 사례 보니 만 명 경제 금융 전무,2.0
삼성SDS,2019-09-10,동반성장지수 삼성전자 년 연속 최우수 종합,4.0
삼성SDS,2019-09-11,삼성전자 텔레콤 동반성장지수 최우수,2.0
삼성SDS,2019-09-16,오비맥주 등 곳 동반성장 미흡 삼성전자는 년 연속 최우수 등급,2.0
삼성SDS,2019-09-17,삼성전자 년연속 동반성장지수 최우수,2.0
삼성SDS,2019-09-18,삼성전자 년연속 동반성장 최우수,2.0
삼성SDS,2019-09-19,오비맥주 쿠쿠전자 등 개사 동반성장지수 최하위,2.0
삼성SDS,2019-09-20,암웨이 쿠쿠 등 동반성장지수 최하위,2.0
삼성SDS,2019-09-23,대학생 취업 창업 멘토링 특강 찾아가는 포럼 서울대서 첫 개최,2.0
삼성SDS,2019-09-24,찍히면 끝 기업들 공정위 포비아,2.0
삼성SDS,2019-09-25,두 손 자유롭게 서비스 업종 솔루션 확대하는 삼성,2.0
삼성SDS,2019-09-26,홍원표 삼성 사장 싱가포르 총리 만나 등 첨단기술 국방분야 적용 논의,2.0
삼성SDS,2019-09-30,지대범 제 대 지역정보개발원장,2.0
삼성SDS,2019-10-01,사내벤처 운영 이렇게 중기부 매뉴얼 운영규정 표준안 공개,2.0
삼성SDS,2019-10-02,다산 칼럼 물은 배를 띄우지만 뒤집을 수도,2.0
삼성SDS,2019-10-07,호텔신라 신세계 외국인 꽉 붙잡다,2.0
삼성SDS,2019-10-08,삼성 와이파이 일체형 스마트 도어록 출시,2.0
삼성SDS,2019-10-10,이슈분석 삼성그룹 전자 계열사 각자도생 성적표,2.0
삼성SDS,2019-10-15,문 열림 침입 스마트폰으로 즉시 확인,0.0
삼성SDS,2019-10-14,더 똑똑하고 더 안전해진 스마트 도어록,2.0
삼성SDS,2019-10-16,스마트폰으로 우리집 현관문 열어요,2.0
삼성SDS,2019-10-17,공정위 압박에 투자심리 위축,2.0
삼성SDS,2019-10-21,규제 발목 인슈어테크 경쟁력 보다 낮아,2.0
삼성SDS,2019-10-22,전자문서분야 도입 활발 보안 관리비 두토끼,2.0
삼성SDS,2019-10-23,생명보험협회 차 산업혁명 관련 세미나 개최,2.0
삼성SDS,2019-10-24,삼성 와이파이로 현관문 열어요,4.0
삼성SDS,2019-10-25,서울 방이동에 억원대 오피스텔 분양,4.0
삼성SDS,2019-10-28,생보협회 보험 미래를 향한 혁신 국제 세미나,2.0
삼성SDS,2019-10-30,김상조 고발 속도내는 삼성 주주들,2.0
삼성SDS,2019-10-29,삼성전자 등 개 해외대학에 딥러닝 등 공동연구 제안,2.0
삼성SDS,2019-10-31,블록체인 생활속으로 스마트폰 갖다대니 생산이력 쫙,2.0
삼성SDS,2019-11-01,강문순의 이슈 들여다보기 매도 한마디에 주가 폭락 공매도 노린 의심 끊이지 않아,2.0
삼성SDS,2019-11-04,훅 날아간 김치 프리미엄 가상화폐 투기 논란 그 후,2.0
삼성SDS,2019-11-05,무역전쟁 피난처 내수 최저임금 인상 직격탄 맞나,2.0
삼성SDS,2019-11-06,악재 나올만큼 나왔다 삼성그룹 펀드 재조명,2.0
삼성SDS,2019-11-07,마켓인사이트 눈높이 낮춘 공모가 롯데정보통신 만 원 확정,2.0
삼성SDS,2019-11-08,펀드 지옥 속 기댈 건 고점 논란에도 더 간다,2.0
삼성SDS,2019-11-11,금융보안원장 연내 블록체인 인증 상호연동 추진,2.0
삼성SDS,2019-11-12,최저임금 인상에 편의점 % 폭락,2.0
삼성SDS,2019-11-13,기술주 훈풍에 삼성전자 하이닉스 상승,2.0
삼성SDS,2019-11-15,혁신기업을 가다 메가투스 창립 주년 맞아 연계통합 미들웨어 글로벌 기업으로 나간다,4.0
삼성SDS,2019-11-14,삼성 하반기 채용 지난해와 같은 천명 수준 유지한다,2.0
삼성SDS,2019-11-18,비주력 의미 뭐냐 김상조 일감 몰아주기 해법에 뿔난 투자자,2.0
삼성SDS,2019-11-19,불량식품 막고 차량 안전 거래 실생활로 들어온 블록체인,2.0
삼성SDS,2019-11-20,사사건건 발목잡는 대 허들 정부 이번엔 밀어붙인다,2.0
삼성SDS,2019-11-21,금리 역전으로 이탈 시장이 불안할 땐 방어주 공략을,2.0
삼성SDS,2019-11-22,이건희 회장 올 주식가치 조 넘게 줄어,2.0
삼성SDS,2019-11-25,김상조 쇼크 여진에 이노션 주 신저가,2.0
삼성SDS,2019-11-26,전자 의존 낮추니 삼성전기 훨훨,2.0
삼성SDS,2019-11-27,가짜 많은 의약품시장 블록체인 도입 필요,2.0
삼성SDS,2019-11-28,롯데정보통신 일 상장 서비스 판도변화 글쎄,2.0
삼성SDS,2019-12-02,김과장 이대리 슬램덩크처럼 힘찬 점프볼,2.0
삼성SDS,2019-11-29,전자여권 이커버 사업 연속 수주 눈앞,2.0
삼성SDS,2019-12-03,반도체 뺀 담은 만 살아남았다,2.0
삼성SDS,2019-12-04,국내 최초 상급종합병원 클라우드 사업 개시 정밀의료 구현 속도,2.0
삼성SDS,2019-12-06,중고차 사기 걱정마세요 블록체인이 해결사,2.0
삼성SDS,2019-12-05,프리즘 스위스 추크와 두바이가 주는 교훈,2.0
삼성SDS,2019-12-09,삼성 영업익 억원 % 늘어,2.0
삼성SDS,2019-12-10,선택약정할인 증가에 분기도 우울,2.0
삼성SDS,2019-12-11,대기업 입사했다 방송기자 거쳐 어릴 적 배우의 꿈 드디어 이뤘죠,2.0
삼성SDS,2019-12-12,이해진 김범수 김정주 재조명 받는 인터넷벤처 세대,2.0
삼성SDS,2019-12-13,삼성전자 드림클래스 전국 개 학생 명과 중학생 명의 여름캠프,2.0
삼성SDS,2019-12-16,이사 선임 해임권까지 거머쥔 국민연금 거대한 행동주의 펀드 됐다,2.0
삼성SDS,2019-12-18,닥터 시대 전세계 의료업계 불꽃경쟁,2.0
삼성SDS,2019-12-19,와이브로 년 만에 종료 모두 연내 중단 계획 종합,2.0
삼성SDS,2019-12-23,사라지는 년기업의 꿈 세율 이대로면 경영권 수성 불가능 상속세 포비아 확산,2.0
삼성SDS,2019-12-24,블록체인 선진국 에스토니아 사례를 공부하자,2.0
삼성SDS,2019-12-26,단독 삼성꿈장학재단 이사장 캠프 출신 노성태 내정,2.0
삼성SDS,2019-12-27,삼성꿈장학재단 이사장에 캠프 출신 노성태 내정,2.0
삼성SDS,2019-12-30,모건스탠리 팔아라 에 급락한 하이닉스,2.0
삼성SDS,2020-02-03,소프트웨이브 바이오헬스도 융합시대,2.0
삼성SDS,2020-02-04,코미코 원익 등 반도체 장비 최대 수혜,2.0
삼성SDS,2020-02-05,소프트웨이브 정보통신산업진흥원 공공 사업 혁신방안 소개,2.0
삼성SDS,2020-02-06,조 제트기류 올라탄 삼바 따라붙는다,4.0
삼성SDS,2020-02-07,변동성 높은 증시 개 무적펀드 눈길,2.0
삼성SDS,2020-02-10,춤추는 삼바 미소짓는 반도체 장비 소재,2.0
삼성SDS,2020-02-11,클라우드 시장 팽창에 지고 뜬다,2.0
삼성SDS,2020-02-12,내우외환 위기 헤쳐나갈 해결사 인방,2.0
삼성SDS,2020-02-13,삼성 하반기 공채 앞서 대학 설명회 개최,2.0
삼성SDS,2020-02-14,삼성 투자 호재 대 전략사업 지속 성장 삼성 주목할 만,2.0
삼성SDS,2020-02-17,부고 이정자씨 별세,2.0
삼성SDS,2020-02-19,이마트 전기차 충전소 초간편 첨단설비로 바뀐다,2.0
삼성SDS,2020-02-20,통 큰 투자 삼성 한화 등 대 그룹 기대 잡아라,2.0
삼성SDS,2020-02-21,부고 김숙자 별세 박성훈 모친상,0.0
삼성SDS,2020-02-24,휴가때 빈집 지키는 보안장치,0.0
삼성SDS,2020-02-25,외국계 리포트 맹신 괜찮나 셀트리온 한미약품에 지나친 비관론 골드만 매도 리포트 정면 반박,2.0
삼성SDS,2020-02-26,부음 조항의씨,2.0
삼성SDS,2020-02-27,오늘의 부고 년 월 일,0.0
삼성SDS,2020-02-28,부고 김순자씨 별세 외,0.0
삼성SDS,2020-03-02,부고 김순달씨 별세,2.0
삼성SDS,2020-03-03,혼조장서 이 개월째 사들인 종목,2.0
삼성SDS,2020-03-04,부음 김경옥 별세 외,4.0
삼성SDS,2020-03-05,부고,2.0
삼성SDS,2020-03-06,부고 이연선씨 별세,2.0
삼성SDS,2020-03-09,소액주주한테 고소당한 김상조 노후 자금인데,0.0
삼성SDS,2020-03-10,게임 인터넷 산업 견인 상용 존재감은 미약,2.0
삼성SDS,2020-03-11,사업 다각화 리스크 관리가 실적 명암 갈랐다,2.0
삼성SDS,2020-03-12,대형병원 차세대 사업자 선정 난항 자체 개발 부작용 부메랑,0.0
삼성SDS,2020-03-13,성장 우리가 이끈다 네오플 넥슨 엔씨 조 클럽 진입,0.0
삼성SDS,2020-03-16,물류 제조 현장서 잘 만든 열사람 안부럽네,0.0
삼성SDS,2020-03-17,빠질만큼 빠졌다 삼성그룹주펀드 썰물 진정세,0.0
삼성SDS,2020-03-18,경제 위기 터키를 가다 터키의 환율 단계별 시나리오 준비,2.0
삼성SDS,2020-03-19,대형주 휘청 증시 흔드는 외국계 리포트,2.0
삼성SDS,2020-03-20,무언설태 추미애 소득주도성장 더 인내해야 도대체 언제까지,4.0
삼성SDS,2020-03-23,경제정책 어디서부터 잘못됐나 어공 이 장악한 경제라인 현실 무시한 동화 속 정책만 쏟아내,0.0
삼성SDS,2020-03-24,공정위가 공정하지 못했다,4.0
삼성SDS,2020-03-25,미래 신기술 브랜드경영 선언,2.0
삼성SDS,2020-03-26,유망 스타트업 끌어안는 게 답 미래파트너 찾는 기업,0.0
삼성SDS,2020-03-27,파손 사진만 올려도 내년부터 보험 청구된다,2.0
삼성SDS,2020-03-30,삼성 에스오일 외국인 기관 쌍끌이 매수에 껑충,4.0
삼성SDS,2020-03-31,삼성 하반기 대졸 공채 예열 채용설명회 회 확정,2.0
삼성SDS,2020-04-01,블록체인 등 개 신기술 브랜드 론칭,0.0
삼성SDS,2020-04-02,막 오르는 대기업 하반기 공채 월 일 롯데 일부터 원서 접수,4.0
삼성SDS,2020-04-03,선점 나선 지니언스 알려지지 않은 사이버 공격도 선제 대응,2.0
삼성SDS,2020-04-06,박근혜 항소심 년 선고 이재용 승계작업 존재했고 박근혜에 묵시적 청탁 있었다,4.0
삼성SDS,2020-04-07,토종기업 상호운용성 테스트 대거 참여,2.0
삼성SDS,2020-04-08,서비스업계 공공 금융 클라우드 잡아라,2.0
삼성SDS,2020-04-09,공정거래법 전면 개정안 재계 기업활동 자유 침해 우려,2.0
삼성SDS,2020-04-13,김태훈 델 부사장 버투스트림 데이터 센터 증설 내년 제 센터 가능,0.0
삼성SDS,2020-04-14,그룹 대규모투자 후광효과 삼성 실리콘웍스 웃다,4.0
삼성SDS,2020-04-16,은행 곳만 인증하면 다른은행 이용도,2.0
삼성SDS,2020-04-20,안전성과 편의성 높였다는 뱅크사인 사용해보니 글쎄,2.0
삼성SDS,2020-04-22,일감몰아주기 규제 강화에 대형 서비스업계도 촉각 매출 구조 다변화 이끄나,2.0
삼성SDS,2020-04-23,은행 공동인증 뱅크사인 산은 씨티 카뱅 빠진 채 반쪽 출범,2.0
삼성SDS,2020-04-24,현장르포 블록체인 인증서 뱅크사인 사용 첫날 별도 앱 설치 필요한데다 호환도 안돼 불편,0.0
삼성SDS,2020-04-27,은행도 블록체인 공인인증 보안 높인 뱅크사인 오픈,2.0
삼성SDS,2020-04-28,공장 자동화 넘어 지능화 삼성 넥스플랜트 키운다,2.0
삼성SDS,2020-05-04,삼성 인텔리전트 팩토리 강화,0.0
삼성SDS,2020-05-06,홍원표 삼성 사장 지능형 공장 승부수,4.0
삼성SDS,2020-05-07,삼성 인텔리전트 팩토리 사업 강화,4.0
삼성SDS,2020-05-08,삼성 설계부터 똑똑한 인텔리전트팩토리시대 연다,2.0
삼성SDS,2020-05-11,제조 자동화에서 지능화 로 삼성 넥스플랜트 고도화,4.0
삼성SDS,2020-05-12,삼성 신사업 전략 공개 설비부터 물류까지 적용,0.0
삼성SDS,2020-05-13,삼성 인텔리전트 팩토리 강화 제조공장에서 플랜트까지 등 신기술 적용,2.0
삼성SDS,2020-05-14,삼성 기반 인텔리전트팩토리 사업 강화 플랜트까지 사업 확대,0.0
삼성SDS,2020-05-15,생산성 % 높이면 억 절감 기반 스마트팩토리 확산 박차,2.0
삼성SDS,2020-05-18,삼성 인텔리전트 팩토리에 사업 집중,2.0
삼성SDS,2020-05-19,삼성 만명 명 대기업만 만 여명 통 큰 채용,2.0
삼성SDS,2020-05-20,가 공장관리 스마트 팩토리가 성장동력,2.0
삼성SDS,2020-05-21,그룹사 곳 중복지원 가능 현대차 부문 채용 확대,2.0
삼성SDS,2020-05-22,현대엔지니어링 판교 알파돔시티 오피스텔 등 월 분양,2.0
삼성SDS,2020-05-25,스마트팩토리 부각에 자동화 관련 쑥,4.0
삼성SDS,2020-05-26,정책에 널뛰는 개미들 부글부글,2.0
삼성SDS,2020-05-28,보험 블록체인 기반 범공인인증 도입 생 손보 온도차,2.0
삼성SDS,2020-05-27,제 회 서울국제 컨퍼런스 김솔 한국외국어대학교 교수 파생상품 중장기적 대안투자로도 활용,2.0
삼성SDS,2020-05-29,리포트 국내 말 못하는 외국계는 가능한 이유,2.0
삼성SDS,2020-06-01,토요워치 사고 사진 몇 장이면 수리비 견적 뚝딱 금융판 바꾸는 비서,2.0
삼성SDS,2020-06-02,기아차 자소서 분석 스펙 대기업 직무 적합성 우선,2.0
삼성SDS,2020-06-04,의료 금융 제조업 등 데이터 혁신 속도,0.0
삼성SDS,2020-06-05,까지 아마존 클라우드 쓰는 보안 트라우마 에 갇힌,2.0
삼성SDS,2020-06-08,벼랑끝 코리아 산업 발전 생태계 변화에 달렸다,2.0
삼성SDS,2020-06-09,삼성그룹주 맞나 불황 늪 벗어나지 못하는 삼성중공업,2.0
삼성SDS,2020-06-10,체인아이디 하나면 인증기관도 거칠 필요 없어요,4.0
삼성SDS,2020-06-11,헬스 파일 대장암 조기 발견 위한 장주행 캠페인,2.0
삼성SDS,2020-06-12,벼랑 끝 코리아 스마트공장 핵심 기술 국산화로 승부해야,0.0
삼성SDS,2020-06-15,삼성 전자 계열사들 공채 시작 채용규모 확대,0.0
삼성SDS,2020-06-16,삼성 하반기 대졸 신입 공채 시작 대규모 채용 보따리 풀린다,4.0
삼성SDS,2020-06-17,삼성 하반기 신입 공채 내달 일 직무적성검사,2.0
삼성SDS,2020-06-18,대기업 공채 스타트 현대차 일 화학 일 삼성 일 입사 원서 마감,2.0
삼성SDS,2020-06-22,하반기 대졸 취업문 다소 숨통 트인다,2.0
삼성SDS,2020-06-24,오라클 내년 클라우드 데이터센터 가동한다,2.0
삼성SDS,2020-06-23,씨드랩 기 사내벤처 차자줌 장현주 소사장,2.0
삼성SDS,2020-06-25,성공 야기 김종성 엠플러스 대표 단순한게 좋은 장비 기능 더하기보다 빼기에 집중했죠,0.0
삼성SDS,2020-06-26,대기업 조직력 스타트업 창의력 융합 신사업 금맥 캔다,2.0
삼성SDS,2020-06-29,개인도 가상화폐 발행해 투자받는다,0.0
삼성SDS,2020-06-30,삼성 현대건설 쌍끌이 주목,2.0
삼성SDS,2020-07-01,삼성 디자인 앱 최우수상,2.0
삼성SDS,2020-07-02,삼성도 공채 돌입 월 일 직무적성검사,4.0
삼성SDS,2020-07-03,국민미래포럼 대통령 한반도 평화는 반드시 가야 할 길,2.0
삼성SDS,2020-07-06,삼성전자 힘못써도 삼성그룹 펀드 꿋꿋,2.0
삼성SDS,2020-07-07,삼성전자 브랜드 가치 조 하이닉스 위 껑충,2.0
삼성SDS,2020-07-09,반도체의 힘 삼성전자 브랜드 가치 조원,2.0
삼성SDS,2020-07-10,브랜드파이낸스 삼성전자 브랜드 가치 조원,2.0
삼성SDS,2020-07-13,반도체의 힘 삼성전자 하이닉스 브랜드 가치 껑충,4.0
삼성SDS,2020-07-14,삼성의 브랜드 가치,2.0
삼성SDS,2020-07-15,삼성전자 브랜드 가치 조원 세계 톱 서 유일한 미국기업,2.0
삼성SDS,2020-07-16,삼성전자 브랜드가치 조원 한국 위 합친것보다 많다,0.0
삼성SDS,2020-07-17,판교 집값 송파 턱밑 추격 당 만원 돌파,2.0
삼성SDS,2020-07-20,판교 아파트값 급등 서울 송파도 넘본다,2.0
삼성SDS,2020-07-21,삼성전자 이름값 조원 년새 % 늘어,2.0
삼성SDS,2020-07-23,외인 기관 올들어 삼성전자 순매도,0.0
삼성SDS,2020-07-24,고맙다 스마트팩토리 삼성 한달새 % 껑충,2.0
삼성SDS,2020-07-27,두산 디지털혁신으로 서비스기업 변신,2.0
삼성SDS,2020-07-28,디브레인 운영 재정당국 정책 개발 뒷받침,2.0
삼성SDS,2020-07-29,관세청 수출통관 물류 서비스에 삼성 블록체인 기술 적용,2.0
삼성SDS,2020-07-31,삼성 블록체인 넥스레저 관세청 수출통관 플랫폼 구축,2.0
삼성SDS,2020-08-03,삼성 블록체인 기반 관세청 수출 통관 서비스 구축,2.0
삼성SDS,2020-08-04,삼성 블록체인 플랫폼 넥스레저 수출 통관 물류서비스에 세계 첫 적용,2.0
삼성SDS,2020-08-05,삼성 수출통관에 세계 첫 블록체인 도입,2.0
삼성SDS,2020-08-06,블록체인 선도 삼성 수출통관 혁신 시동,2.0
삼성SDS,2020-08-10,관세청 삼성 블록체인 적용 수출통관 물류 프로세스 재설계,2.0
삼성SDS,2020-08-07,만명 몰린 삼성고시 넘으려면 오답 줄이고 초내 풀어라,2.0
삼성SDS,2020-08-12,서울시 교통카드 사업자 수익배분 법정공방,4.0
삼성SDS,2020-08-11,바람타고 삼총사 훨훨,2.0
삼성SDS,2020-08-14,주년 창간기획 일자리 다양화 산업 패러다임 바꾼다,2.0
삼성SDS,2020-08-13,삼성 국내 최초 아마존 클라우드 보안 인증 획득,2.0
삼성SDS,2020-08-18,삼성 국내 첫 아마존 클라우드 보안역량 인증,2.0
삼성SDS,2020-08-19,시민단체 입김에 반쪽 그친 은산분리 완화,2.0
삼성SDS,2020-08-20,삼성 클라우드 보안서비스 사업 강화 사이버보안 컨퍼런스 개최,0.0
삼성SDS,2020-08-25,클라우드 보안 공략 강화 삼성 해킹 대응 솔루션 선봬,2.0
삼성SDS,2020-08-26,미래기술 삼성 수출통관에 블록체인 도입 블록체인 기반 지역화폐 발행,2.0
삼성SDS,2020-08-27,클라우드 해킹 위협 대응 보안관제 서비스 시연,2.0
삼성SDS,2020-08-28,기관 사자 에 물산 생명 화재도 껑충,2.0
삼성SDS,2020-08-31,히든히어로즈 시장 검은 돈 막아 투명하게 만들겠다,2.0
삼성SDS,2020-09-01,블록체인의 부터 까지 다 보여준다 세션 개 연사 명,2.0
삼성SDS,2020-09-02,글로벌 게임사 뒤엔 클라우드 서비스 있죠,2.0
삼성SDS,2020-09-03,차장 칼럼 비트코인 년 뒤처진 한국,2.0
삼성SDS,2020-09-04,토종 보안기업 인증 획득 패스워드 없는 사회 선도한다,2.0
삼성SDS,2020-09-07,오답은 감점처리 찍지 말고 비워 두세요,2.0
삼성SDS,2020-09-08,이슈분석 공공정보화 대기업 참여제한 년 웃는 곳이 없다,4.0
삼성SDS,2020-09-09,이슈분석 대기업 참여 공공 사업 연평균 건 제도 개선해야,4.0
삼성SDS,2020-09-10,사설 산업진흥법 당장 손봐야 한다,2.0
삼성SDS,2020-09-11,빅데이터로 범죄 예측 현실이 된 마이너리티 리포트,4.0
삼성SDS,2020-09-14,모바일 안드로이드 처럼 블록체인 메인 플랫폼 을 선점하라,2.0
삼성SDS,2020-09-15,재벌은 어떻게 소비자의 돈을 훔치는가,2.0
삼성SDS,2020-09-16,삼성 캐시카우 삼총사 조클럽 도전,2.0
삼성SDS,2020-09-17,삼성 디지털혁신 사업자로 자리매김,2.0
삼성SDS,2020-09-18,일상 파고드는 블록체인 짝퉁 명품 걸러내고 공인인증서 대체,2.0
삼성SDS,2020-09-21,삼성 신용카드 복제 막는 암호기술 확보,0.0
삼성SDS,2020-09-23,삼성 전자서명 해킹 원천 차단한다,2.0
삼성SDS,2020-09-25,삼성 신용카드 복제 불가능한 암호기술 개발,2.0
삼성SDS,2020-09-24,삼성 신용카드 복제 불가능한 부채널공격 차단 암호기술 확보,2.0
삼성SDS,2020-09-28,삼성 전자서명 부채널공격 해킹방지 기술 확보,4.0
삼성SDS,2020-09-29,삼성 신용카드 복제 원천 차단 해킹방지 암호기술 세계 최초 개발,2.0
삼성SDS,2020-10-05,신용카드 복제 불가 삼성 전자서명 암호기술 확보,4.0
삼성SDS,2020-10-06,한화시스템 이더리움기업연합 가입 블록체인 기반 금융 플랫폼 본격화,2.0
삼성SDS,2020-10-07,한화시스템 글로벌 블록체인 단체 가입,4.0
삼성SDS,2020-10-08,한화시스템도 참여 블록체인 사업 본격 시동,2.0
삼성SDS,2020-10-12,삼성 해킹방지기술 확보 전자서명 부채널 공격 차단,2.0
삼성SDS,2020-10-14,혁신기업을 가다 인프라닉스 고객기반 시스티어 서비스로 국내외 클라우드 시장 공략,2.0
삼성SDS,2020-10-13,수십억 들여 공인인증서 대체한다더니 소비자 외면받는 뱅크사인,2.0
삼성SDS,2020-10-16,인증서 발급 공동 단독 생보업권 블록체인 플랫폼 사업 난항,4.0
삼성SDS,2020-10-19,멀티캠퍼스 하락장서도 쑥쑥,2.0
삼성SDS,2020-10-20,삼성전자 다음달 일 협력사 채용 한마당 개최,2.0
삼성SDS,2020-10-21,삼성전자 월 일 협력사 채용 한마당,2.0
