company,date,title,rise
삼성SDS,2020-10-22,내달 삼성 협력사 채용 한마당 삼성전자 여개 협력사 참여,2.0
삼성SDS,2020-10-23,삼성전자 내달 일 협력사 채용 한마당,2.0
삼성SDS,2020-10-26,수개월째 변동성 장세에 업종별 등주 대거 교체,4.0
삼성SDS,2020-10-27,조 보안 맹주될까 삼성과의 전면전 예고,2.0
삼성SDS,2020-10-28,우리은행 시중은행 최초로 뱅크사인 버전 선보인다,0.0
삼성SDS,2020-10-29,통신 개발자에서 디퓨저 개발자로 향기로 년 내 세계 시장 장악 꿈,0.0
삼성SDS,2020-10-30,정연훈 페이코 대표 온라인 간편결제 노하우 살려 오프라인 시장 확대해 나갈 것,2.0
삼성SDS,2020-11-02,코리아 블록체인 엑스포,2.0
삼성SDS,2020-11-03,삼성전자 월 일 협력사 채용 한마당,4.0
삼성SDS,2020-11-04,사설 민 관이 손잡은 일본 물류혁명 한국도 서둘러야,2.0
삼성SDS,2020-11-05,브리프 뉴스 월 일 삼성 협력사 채용 한마당 등,2.0
삼성SDS,2020-11-06,가짜 판치는 정보의 바다 블록체인과 결합땐 가치의 바다로,0.0
삼성SDS,2020-11-09,대기업 스마트팩토리 속도전,2.0
삼성SDS,2020-11-10,교육에 재미 소셜네트워크 접목 테마파크 같은 콘텐츠 제공할 것,0.0
삼성SDS,2020-11-11,블록체인 프런티어 코리아 도약 국내외 전문가 한자리에,4.0
삼성SDS,2020-11-13,여성임원 가장 많은 대기업은 삼성전자 명,2.0
삼성SDS,2020-11-12,여전히 견고한 대기업 유리천장,2.0
삼성SDS,2020-11-16,국내 대 기업 여성임원 명 첫 돌파,2.0
삼성SDS,2020-11-17,국내 대 기업 여성 임원 올해 처음으로 명 돌파,2.0
삼성SDS,2020-11-18,대 기업 임원 명 돌파 년새 배로 년뒤엔 명,2.0
삼성SDS,2020-11-19,이슈분석 외국계 기업 한국 클라우드 시장 공세,2.0
삼성SDS,2020-11-20,대 기업 여성임원 명 넘었다,2.0
삼성SDS,2020-11-23,브이엠솔루션 국내 위 논리적 망분리 솔루션 브이엠포트 로 진출,2.0
삼성SDS,2020-11-24,심상정 심재철 측 관리자 권한으로 재정정보 접근,2.0
삼성SDS,2020-11-25,심상정 감사관실 아닌 관리자모드 뚫린 것,2.0
삼성SDS,2020-11-26,대 기업 여성임원 명 돌파 년새 배로,2.0
삼성SDS,2020-11-27,국감 한전 적자 어찌할까 김종갑 안전 비용 탓,2.0
삼성SDS,2020-11-30,비인가 자료 유출 심재철 국감자격 논란에 하루 종일 파행,2.0
삼성SDS,2020-12-02,박일평 전자 양대 전시회서 기조연설,2.0
삼성SDS,2020-12-01,삼성 플로우 디자인어워드 수상,2.0
삼성SDS,2020-12-03,삼성 멀티캠퍼스 베트남 진출 기업에 노하우 전수,2.0
삼성SDS,2020-12-04,심재철 정보유출 논란 국가 사이버보안 문제로 확산,2.0
삼성SDS,2020-12-07,삼성그룹주 펀드 약세장 속 선방,2.0
삼성SDS,2020-12-08,과기정통부 세계은행과 개도국 지원펀드 협력방안 논의,2.0
삼성SDS,2020-12-09,삼성 블록체인 플랫폼으로 유럽 해운물류 공략,2.0
삼성SDS,2020-12-10,삼성 블록체인 기반 해운 물류사업,2.0
삼성SDS,2020-12-14,삼성 네덜란드 업체와 블록체인 기술 해운물류 협약,2.0
삼성SDS,2020-12-15,삼성 블록체인 플랫폼으로 유럽 해운물류 공략 나선다,2.0
삼성SDS,2020-12-16,삼성 블록체인으로 유럽 해운물류 공략,2.0
삼성SDS,2020-12-17,대형 기업들 블록체인 짝짓기,2.0
삼성SDS,2020-12-21,한국기업 매력 년새 반토막 났다,2.0
삼성SDS,2020-12-22,글로벌 직장인이 뽑은 대 기업 한국기업 년새 개 개 반토막,2.0
삼성SDS,2020-12-23,삼성 블록체인 기술로 네덜란드 해운물류 참여,2.0
삼성SDS,2020-12-24,삼성 해운물류 블록체인 유럽 공략,2.0
삼성SDS,2020-12-28,삼성 블록체인 활용 물류사업 강화,2.0
삼성SDS,2020-12-29,인공지능 인력 양성 데이터 확보해 산업지능시대 대비하자,2.0
삼성SDS,2020-12-30,제 회 산업기술 혁신성장 좌담회,2.0
삼성SDS,2021-02-02,포브스 일하기 좋은 기업 한국기업은 절반으로 줄어,2.0
삼성SDS,2021-02-04,디지털 혁신으로 용이 된 한국에 개도국 큰 관심,2.0
삼성SDS,2021-02-03,삼성 사무실 사내식당서 플라스틱 아웃,2.0
삼성SDS,2021-02-05,삼성 플라스틱 일회용품 절감 활동 확대,2.0
삼성SDS,2021-02-08,삼성 계열사서 플라스틱 일회용품 아웃,2.0
삼성SDS,2021-02-09,삼성 플라스틱 일회용품 감축 앞장,2.0
삼성SDS,2021-02-10,그린 삼성 전계열사 만명 플라스틱 감축 동참,2.0
삼성SDS,2021-02-15,삼성 전 계열사 플라스틱 사용 연 톤 줄인다,2.0
삼성SDS,2021-02-16,블록체인 중고매매 플랫폼 사례 발표 시장 분석도,4.0
삼성SDS,2021-02-18,차 산업혁명 기술 배우자 다시 학교로 턴 입학생 증가,2.0
삼성SDS,2021-02-19,삼성 플라스틱 일회용품 줄인다,2.0
삼성SDS,2021-02-23,삼성 플라스틱 아웃 일회용품 줄이기 계열사로 확대,2.0
삼성SDS,2021-02-22,블록체인 생태계 뛰어드는 대기업들,2.0
삼성SDS,2021-02-24,블록체인 부가가치 창출 방안 논의하는 전문가들,0.0
삼성SDS,2021-03-02,혁신기업을 가다 씨큐앤비 기술 융합해 사회적 약자 안전 책임질 것,2.0
삼성SDS,2021-03-03,삼성 로 화물도착 정확도 높였다,2.0
삼성SDS,2021-03-05,삼성 로 물류 플랫폼 정확도 높여,2.0
삼성SDS,2021-03-09,스마트팩토리 탄력 삼성 분기 영업익 억,2.0
삼성SDS,2021-03-10,호실적 고배당 저평가 박자 갖춘 삼성물산,2.0
삼성SDS,2021-03-11,가전이 효자 전자 영업익 년 최대,4.0
삼성SDS,2021-03-12,분기 실적도 우울 네이버 주가 연중 최저,2.0
삼성SDS,2021-03-15,테크 기업들의 조원짜리 클라우드 전쟁,2.0
삼성SDS,2021-03-16,치고나가는 삼성,2.0
삼성SDS,2021-03-17,코스피 아시아 증시서 나홀로 급락,2.0
삼성SDS,2021-03-18,여직원 명 중 명 꼴 임원 승진 경영지원에 % 편중,2.0
삼성SDS,2021-03-23,여성 임원 % 대 그룹 중 최고 농협 는,2.0
삼성SDS,2021-03-24,블록포스트 삼성 카카오의 파트너 옵스 한국서 블록체인 영토 넓힌다,2.0
삼성SDS,2021-03-25,삼성 잠실 캠퍼스 소프트웨어 개발자 메카 우뚝,2.0
삼성SDS,2021-03-26,클라우드 승부 이제부터 국내시장도 본격 개화,2.0
삼성SDS,2021-03-29,김과장 대신 김프로 김 님 삼성전자 직급 체계 확대 적용,2.0
삼성SDS,2021-03-30,삼성전자 넥스트 오라클 걷어낸다,4.0
삼성SDS,2021-03-31,김동연 스마트공장 조성 지원으로 일자리 늘릴 것 종합,2.0
삼성SDS,2021-04-01,오브스 자체 암호화폐 첫 상장 한국거래소에서 유럽 제쳤다,2.0
삼성SDS,2021-04-02,삼성 차 산업혁명시대 일하는 방식 바꾼다,2.0
삼성SDS,2021-04-05,대기업 해커톤 대회 이유있는 열풍,2.0
삼성SDS,2021-04-06,쌀 빨대 텀블러 재생 종이 봉투 일회용 플라스틱 아웃,2.0
삼성SDS,2021-04-07,과기정통부장관배 테니스 년연속 우승,2.0
삼성SDS,2021-04-08,이달의 으뜸중기제품 핏펫 동물 소변검사 키트 핏펫 어헤드 아픈 반려견 본 후 회사 관두고 검사 키트 개발,2.0
삼성SDS,2021-04-09,비용보다 변화속도 선두기업 잇따라 도입,2.0
삼성SDS,2021-04-12,대한항공 대기업 첫 클라우드 시스템 전면 도입,2.0
삼성SDS,2021-04-14,글로벌 클라우드 기업 대항마 한 중 일 싱가포르 개국 데이터센터 협의체 뜬다,2.0
삼성SDS,2021-04-13,블록체인 암호화폐 스타트업 막오른 생활밀착서비스 경쟁,2.0
삼성SDS,2021-04-15,삼성 대외사업 강화 지능형 제조 솔루션 공개,2.0
삼성SDS,2021-04-19,삼성 미라콤 스마트팩토리 솔루션 통합 중소 중견 대기업 시장 확장 나선다,2.0
삼성SDS,2021-04-20,데이터사이언스 등 최신 트렌드 신기 국내 없는 사례 접해 시야 넓혔다,2.0
삼성SDS,2021-04-21,종이컵도 비닐봉지도 가라 플라스틱 제로 바람,0.0
삼성SDS,2021-04-22,닫힌 밀폐용기 판매 해외서 연다,2.0
삼성SDS,2021-04-23,미래기술 방대한 디지털 자료 수집해 머신러닝 역사 유추하고 범죄 예측하죠,4.0
삼성SDS,2021-04-26,보유지분 조인데 삼성물산 시총 겨우 조,2.0
삼성SDS,2021-04-27,중기굿즈 차선이탈 신호변경까지 알리는 사고예방 블랙박스,0.0
삼성SDS,2021-04-28,삼성 협력사 채용박람회에 구직자 만명 몰려,2.0
삼성SDS,2021-04-29,고교생부터 대까지 삼성 협력사 취업하자,2.0
삼성SDS,2021-04-30,삼성 협력사 채용에 몰린 인파,2.0
삼성SDS,2021-05-03,삼성전자 협력사 채용 한마당 만여명 북적,2.0
삼성SDS,2021-05-04,포토 삼성 협력사 채용 한마당 에 몰린 구직자들,2.0
삼성SDS,2021-05-06,비교적 괜찮은 일자리 구직자 만여명 몰려,2.0
삼성SDS,2021-05-07,취업박람회 청춘은 많이 아프다,2.0
삼성SDS,2021-05-10,미래기술 갈길 먼 클라우드 업체,2.0
삼성SDS,2021-05-11,삼성 협력사와 손잡고 채용 상생,0.0
삼성SDS,2021-05-12,삼성 협력사 채용 한마당 구직자 만명이 몰렸다,2.0
삼성SDS,2021-05-13,레고 처럼 붙였다 뗐다 도 도입,2.0
삼성SDS,2021-05-14,삼성 데이터 분석 플랫폼 무료공개,4.0
삼성SDS,2021-05-17,삼성 개발자 콘퍼런스 첫 개최 등 노하우 소개,2.0
삼성SDS,2021-05-18,삼성 기술개발 노하우 경험 공유,2.0
삼성SDS,2021-05-21,삼성 개발자 콘퍼런스 테크토닉 개최,2.0
삼성SDS,2021-05-24,삼성 개발자 생태계 넓힌다 테크토닉 개최,2.0
삼성SDS,2021-05-28,전기 역대급 실적 예고한 삼성그룹 인방,2.0
삼성SDS,2021-05-27,테크토닉 정례화해 개발자 역량 강화할 것,2.0
삼성SDS,2021-05-31,등 신기술로 비즈니스 혁신 사례 공유,2.0
삼성SDS,2021-06-01,삼성 첫 개발자대회 여명 몰려,4.0
삼성SDS,2021-06-02,초저평가 삼성물산 거래정지 삼바의 대안,2.0
삼성SDS,2021-06-03,업계 생태계 확장 개발자 콘퍼런스 공들인다,2.0
삼성SDS,2021-06-04,삼성 세계 스타크래프트 대회 우승,2.0
삼성SDS,2021-06-08,삼성 사이다팀 이 만든 스타크래프트 대회,2.0
삼성SDS,2021-06-07,페이스북 스탠퍼드 제치고 삼성 스타크 대회 우승,2.0
삼성SDS,2021-06-09,전 승 삼성 인공지능 세계대회 우승,2.0
삼성SDS,2021-06-10,삼성 세계 스타크래프트 대회 우승,2.0
삼성SDS,2021-06-11,의 인간 정복 바둑 넘어 스타크 로,2.0
삼성SDS,2021-06-14,이동통신 기술 접목에 분주한 게임업계,2.0
삼성SDS,2021-06-15,삼성전자 년만에 월 인사 사장단 인사는 소폭에 그칠듯,2.0
삼성SDS,2021-06-16,박정호의 창업실전강의 사내창업은 가장 손쉬운 창업의 방법이다,2.0
삼성SDS,2021-06-18,인터뷰 신철균 리즘경영파트너그룹 원장 오너 부재에도 문제없는 시스템경영 구축해야,2.0
삼성SDS,2021-06-21,삼성 가 만든 스타크래프트 대회서 % 승률로 우승,2.0
삼성SDS,2021-06-22,삼성 타워 인수후보에 증권 미래에셋대우,2.0
삼성SDS,2021-06-23,삼성전자 대졸공채에 파이썬 도입 오픈소스로 생태계 선점,2.0
삼성SDS,2021-06-24,아시아 다보스포럼 보아오포럼 국내 최초 개최 정 재계 인사 한자리에,2.0
삼성SDS,2021-06-28,의 항변 무역마찰은 미국 탓 한 중 일 체결 한목소리,2.0
삼성SDS,2021-06-29,클라우드로 산업 급변해도 엔터프라이즈 는 신성장기,2.0
삼성SDS,2021-06-30,재계 총수 대거 빠진 보아오포럼 흥행 실패,2.0
삼성SDS,2021-07-01,진흥법의 역설 참여제한 빅 는 크고 중견 는 뒷걸음,2.0
삼성SDS,2021-07-02,스타크래프트 왕좌 차지한 삼성,2.0
삼성SDS,2021-07-07,부음 김창진씨 별세 외,2.0
삼성SDS,2021-07-08,부고 김창진 씨 별세 영철 병철 현철 부친상 태희 조부상,2.0
삼성SDS,2021-07-09,황상기 대표 오늘의 사과 삼성의 다짐으로 알겠다,2.0
삼성SDS,2021-07-12,머리 숙인 삼성 반도체 백혈병 년 논란 마침표,2.0
삼성SDS,2021-07-13,삼성 반도체 백혈병 분쟁 매듭 직접고용 등 난제 잇단 해결 사회적 합의에 더 노력,2.0
삼성SDS,2021-07-14,한국 공공시장 열린다 구름 몰고온 공룡들,2.0
삼성SDS,2021-07-15,탄력근로 편들기에 재계 당장 내년엔 범법자될라,2.0
삼성SDS,2021-07-19,외국사 선점 클라우드 시장 국내사 대역전 가능,2.0
삼성SDS,2021-07-21,우리 곁 수많은 유미씨 에게 희망이 생겼습니다,2.0
삼성SDS,2021-07-20,정태명의 사이버펀치 말로만 하는 재발 방지는 식상하다,2.0
삼성SDS,2021-07-22,금융권 블록체인사업 보여주기식 급급,2.0
삼성SDS,2021-07-26,경기도의회 삼성에 공공부지 특혜매각 조사 추진,2.0
삼성SDS,2021-07-27,대기업 계열사 프리미엄 그건 옛날 얘기고,2.0
삼성SDS,2021-07-28,벽에 거는 스피커 하늘 위 휴게소 우리가 디자인 국가대표,2.0
삼성SDS,2021-07-29,바닥 아니었나 폭락장 이후에도 신저가 종목 개,2.0
삼성SDS,2021-08-02,공항서 로 액체 스프레이 걸러낸다,2.0
삼성SDS,2021-07-30,숨죽인 재계의 별 들 이번주 임원인사 슈퍼위크,2.0
삼성SDS,2021-08-03,토종 사 이스라엘 스타트업 플랫폼 경쟁 파전,2.0
삼성SDS,2021-08-04,이성열 코리아 대표 자동화 쉽고 효과도 커 스마트팩토리로 디지털혁신,2.0
삼성SDS,2021-08-05,이번주 재계 인사 슈퍼위크 삼성 숨고르기 조직재정비,2.0
삼성SDS,2021-08-06,화재에도 시스템 정상운영 중 중망 가동한 대기업,2.0
삼성SDS,2021-08-09,시총 위 띄운 클라우드 국내 유망 찜,2.0
삼성SDS,2021-08-10,블록체인 쇠고기 원산지 정보 한눈에 이력추적 해결사 블록체인,0.0
삼성SDS,2021-08-11,이달의 과학기술인상 천정희 서울대 교수 암호학적 다중선형함수 해독 난제였던 안전성까지 잡아,2.0
삼성SDS,2021-08-12,삼성 창사 이후 첫 여성 부사장,2.0
삼성SDS,2021-08-13,삼성인사 삼성 여성 부사장 시대 열었다,2.0
삼성SDS,2021-08-17,삼성전자 반도체 부문 승진잔치 김기남 부회장 승진,2.0
삼성SDS,2021-08-18,프로필 삼성 부사장,2.0
삼성SDS,2021-08-19,인사 삼성전자,0.0
삼성SDS,2021-08-23,주요 계열사 교체없어 물산 이끄는 김명수 사장 승진,2.0
삼성SDS,2021-08-24,임원 승진 폭 줄여도 여성 외국인 승진자는 유지,2.0
삼성SDS,2021-08-25,인사 과학기술정보통신부 외,2.0
삼성SDS,2021-08-27,생보업권 블록체인 플랫폼 사업 무산 아직은 시기상조,2.0
삼성SDS,2021-08-31,겨울 대비하는 삼성전자 임원 승진 작년보다 % 줄여,2.0
삼성SDS,2021-09-02,경제계 인사 삼성물산 사장에 김명수씨 외,2.0
삼성SDS,2021-09-06,경제계 인사 호반건설 송종민 박철희 각자대표,2.0
삼성SDS,2021-09-07,유통 미디어까지 디지털 대전환 할것,2.0
삼성SDS,2021-09-08,부고 서병기씨 별세,2.0
삼성SDS,2021-09-09,삼성 관계사 % 클라우드 전환 내년부터 공공 금융시장에 집중,2.0
삼성SDS,2021-09-10,로 가는 승진열차 평균 세 이공계 출신 유학파 탑승,2.0
삼성SDS,2021-09-14,마켓인사이트 서울 대형오피스 자금조달 싹쓸이,2.0
삼성SDS,2021-09-16,부음 권금애 별세 외,2.0
삼성SDS,2021-09-15,포럼 투자 불감증 이 부른 화재,2.0
삼성SDS,2021-09-17,부고 강길환 별세 전혜경 남편상 주연 주용 부친상 최동욱 장인상 안아리 시부상,2.0
삼성SDS,2021-09-23,렌트카 중기 적합업종 지정 대기업은 년간 사업 확장 제한,2.0
삼성SDS,2021-09-27,부고 정석목 삼성 전무 씨 모친상,2.0
삼성SDS,2021-09-24,삼성바이오 거래 재개에도 삼성그룹 펀드 힘 못쓰네,2.0
삼성SDS,2021-09-28,오늘의 부고 년 월 일,0.0
삼성SDS,2021-09-29,부고 이근우씨 별세,2.0
삼성SDS,2021-10-07,부고 권영조씨,2.0
삼성SDS,2021-10-06,시사용어 사내독립기업,2.0
삼성SDS,2021-10-12,한경과 맛있는 만남 장화진 대표 하드웨어서 소프트웨어 전문가 변신 출신으로 첫 한국 총괄 맡아,0.0
삼성SDS,2021-10-13,부음 조각가 김인겸 별세 외,4.0
삼성SDS,2021-10-14,부고 권영조 별세 정석목 모친상,2.0
삼성SDS,2021-10-15,실적 괜찮은데 공모가 % 밑돈 새내기 속출,2.0
삼성SDS,2021-10-18,파티는 끝났다 잘나가던 게임 포털도 벌벌,2.0
삼성SDS,2021-10-19,엔 삼성 없지만 삼성그룹주 에스원 멀티캠퍼스 실적에 쑥쑥,2.0
삼성SDS,2021-10-20,독하게 살뺀 삼성 남매 외국인 조 베팅,2.0
삼성SDS,2021-10-25,리포트 토큰 없어도 돼 프라이빗 블록체인 득세,2.0
삼성SDS,2021-10-22,결산 클라우드 바람 속 업계 잇단 상장,2.0
삼성SDS,2021-10-26,알립니다 매경 기 명예기자가 독자 여러분을 찾아갑니다,2.0
삼성SDS,2021-10-27,비트코인 이더리움과 협력해 공생하자,2.0
삼성SDS,2021-10-29,첨단항구 변신 네덜란드 투자 쇄도 최대항구 에 판 그리스 인재 유출,2.0
삼성SDS,2021-10-28,로 무장한 로테르담항 세계서 가장 똑똑한 물류허브,0.0
삼성SDS,2021-11-01,열살 된 블록체인 년 실용화 제도화 원년 삼는다,4.0
삼성SDS,2021-11-03,부고 이필규씨 별세 외,2.0
삼성SDS,2021-11-02,보급 본격화 헬스케어도 성장 클라우드 엔터 자율 바이오 유망,2.0
삼성SDS,2021-11-04,부음 예술원 회장 지낸 한국화가 민경갑 별세 외,2.0
삼성SDS,2021-11-05,턴의 조건 공공 서비스 대기업 참여 제한 이대로 괜찮나,2.0
삼성SDS,2021-11-08,불모지 의료 클라우드 새해 도입사업 줄이어 성공사례 확보 관건,2.0
삼성SDS,2021-11-10,부고 권유선 씨 별세 안길섭 장인상,2.0
삼성SDS,2021-11-09,진격의 삼성 영그는 영업익 조클럽 꿈,2.0
삼성SDS,2021-11-11,홍원표 사장 삼성 해외공략 올인,2.0
삼성SDS,2021-11-12,이통 사 시대 일상을 바꾸는 변화 일으키자,2.0
삼성SDS,2021-11-15,비 오는날엔 막걸리 추천 우울한 날 고민상담 날 알아주는,2.0
삼성SDS,2021-11-16,서비스업계 특화 플랫폼 솔루션으로 성장,4.0
삼성SDS,2021-11-17,오피스빌딩 매매가 사상최고 당 평균 만원,0.0
삼성SDS,2021-11-18,작년 서울 대형 오피스빌딩 매매가 최고치 경신 % 올라,2.0
삼성SDS,2021-11-19,당당 업계,2.0
삼성SDS,2021-11-22,서비스 빅 같은 듯 다른 혁신 전략,2.0
삼성SDS,2021-11-23,방이동 모텔골목 대변신 싱글족 인기 주거촌으로,2.0
삼성SDS,2021-11-24,올해 서비스 시장 전년 % 해외진출 신사업으로 저성장 시대 대비해야,2.0
삼성SDS,2021-11-25,작년 대기업 참여 공공 사업 전년보다 줄어,2.0
삼성SDS,2021-11-26,자신이 관심있는 일해야 재미 청년 창업 도전하기 좋아졌다 긍정 에너지 뿜뿜 새해 릴레이 인터뷰,0.0
삼성SDS,2021-11-29,가 사고차량 수리비 견적 뽑는다,2.0
삼성SDS,2021-11-30,신동렬 성균관대 신임 총장 취임,0.0
삼성SDS,2021-12-01,신동렬 성균관대 신임 총장 취임,4.0
삼성SDS,2021-12-02,이해진 네이버 창업자 네이버는 매년 태어나고 매년 살아남는 회사,4.0
삼성SDS,2021-12-03,은둔의 경영자 소신 발언 하는 이해진 외국 정치인들은 자국기업 키우는데,2.0
삼성SDS,2021-12-06,삼성 올 만명 역대급 채용 필수,2.0
삼성SDS,2021-12-07,김범수 의장 통신서 온라인게임 메신저 넘어 카풀 인터넷은행으로,2.0
삼성SDS,2021-12-08,김범수의 인재 경영 남궁훈 문태식 다시 카카오에 모인 옛 동료들,2.0
삼성SDS,2021-12-09,부음 김병곤 풍기동부교회 안수집사 별세 외,2.0
삼성SDS,2021-12-10,블록체인 정부사업 골리앗 다윗 경쟁 점화,4.0
삼성SDS,2021-12-13,내부거래에 갇혀 진퇴양난에 빠진 삼성 등으로 신성장 동력 마련 시급,0.0
삼성SDS,2021-12-14,이슈분석 대형 서비스 사 내부거래 얼마나 했나,2.0
삼성SDS,2021-12-15,이슈분석 공정위 서비스 시장 예의주시 내부거래 많은 업종 분석 대책마련,2.0
삼성SDS,2021-12-20,진화하는 부동산펀드,2.0
삼성SDS,2021-12-21,서비스 빅 조직개편 보면 올해 주력사업 보인다,2.0
삼성SDS,2021-12-22,주 시간제 때문에 네이버 임원제 부활,2.0
삼성SDS,2021-12-24,삼성 현대건설기계 수주,2.0
삼성SDS,2021-12-23,삼성 차세대 시장 공략 강화,2.0
삼성SDS,2021-12-27,삼성 년 노하우 현대건설기계에 적용,2.0
삼성SDS,2021-12-28,삼성 차세대 대외시장 확장,2.0
삼성SDS,2021-12-29,삼성 외부 고객사 확대 차세대 시장 공략 강화,2.0
삼성SDS,2022-01-03,부고 조기승 삼성 수석 연구원 씨 부친상,2.0
삼성SDS,2022-02-04,기력찾은 삼성전자 그룹 펀드 도 불끈,2.0
삼성SDS,2022-02-07,삼성 차세대 시장 공략 강화 현대건설기계 경인양행 등 구축 성과,2.0
삼성SDS,2022-02-08,사설 실패해도 좋다 는 하이닉스의 벤처 실험,2.0
삼성SDS,2022-02-09,전문기자칼럼 누구를 위한 위 기업인가,2.0
삼성SDS,2022-02-10,세계 위 데이터센터 기업 이퀴닉스 한국 상륙,2.0
삼성SDS,2022-02-14,대한민국 희망 프로젝트 애자일,0.0
삼성SDS,2022-02-15,년만에 복귀하는 삼성 공공 서비스 지각변동 예고,2.0
삼성SDS,2022-02-16,마켓 현대차 하이닉스 분기 실적 발표 쏟아져,2.0
삼성SDS,2022-02-17,이슈분석 윈도 지원 종료 년 기업 개인 전환 검토 시급,2.0
삼성SDS,2022-02-18,해외송금 결제 은행권 블록체인 기술 상용화 경쟁,2.0
삼성SDS,2022-02-21,사내벤처 제 전성시대 창업 년만에 혁신상 비결은,2.0
삼성SDS,2022-02-22,에퀴닉스 삼성 와 손잡고 한국시장 연착륙,2.0
삼성SDS,2022-02-23,서울에도 에퀴닉스 데이터센터 생긴다,2.0
삼성SDS,2022-02-25,알립니다 애자일 선도기업 직접방문 생생한 노하우 공개합니다,2.0
삼성SDS,2022-03-02,글로벌 위 데이터센터 에퀴닉스 국내 인프라 시장 대격변 예고,2.0
삼성SDS,2022-03-03,비상벨 울리는 상업용 부동산,2.0
삼성SDS,2022-03-04,훨훨 난 삼성 조클럽 등극,2.0
삼성SDS,2022-03-07,삼성 매출 조 넘었다,0.0
삼성SDS,2022-03-08,삼성 작년 매출 조 돌파,2.0
삼성SDS,2022-03-10,삼성 서비스업계 첫 매출 조 돌파,4.0
삼성SDS,2022-03-14,삼성 지난해 매출 조원 돌파,2.0
삼성SDS,2022-03-15,증권 컨소 잠실 삼성 타워 인수 마무리,2.0
삼성SDS,2022-03-16,한국상용 협회 신입협회장에 송영선 인프라닉스 대표,2.0
삼성SDS,2022-03-17,롯데정밀 멀티캠퍼스 작년 실적 최대,2.0
삼성SDS,2022-03-21,파워기업 인프라닉스 기업 협업모델 만들기 집중,2.0
삼성SDS,2022-03-22,삼성 연 매출 조원 첫 돌파,0.0
삼성SDS,2022-03-23,강남 갔던 삼성 다시 강북으로 턴하나,4.0
삼성SDS,2022-03-24,국내 금융 대표주자들 글로벌 블록체인 생태계 입성 나섰다,2.0
삼성SDS,2022-03-25,삼성 협력사 대금 조 억 조기지급,2.0
삼성SDS,2022-03-28,삼성 설 앞두고 협력사 물품 대금 조 천억 조기 지급,2.0
삼성SDS,2022-03-29,삼성 통 큰 설맞이 상생 조 억원 물품 대금 조기 지급,4.0
삼성SDS,2022-03-31,삼성 설맞이 협력사 물품 대금 조 조기 지급 직거래 장터 운영도,4.0
삼성SDS,2022-04-01,협력사에 조기결제 직거래장터까지 훈훈한 삼성 설 행보,2.0
삼성SDS,2022-04-04,삼성그룹 설 앞두고 협력사에 조기 지급,2.0
삼성SDS,2022-04-05,삼성 농축산물 직거래 장터,2.0
삼성SDS,2022-04-07,협력사 물품대금 조 억 삼성 설 전에 조기 지급키로,2.0
삼성SDS,2022-04-11,삼성그룹 개사 설 협력사 물품대금 조 억 조기 지급,2.0
삼성SDS,2022-04-12,삼성 협력사 대금 조 억 조기 지급,2.0
삼성SDS,2022-04-13,홍길용의 화식열전 시동거는 정의선 지배구조 방향은,2.0
삼성SDS,2022-04-15,빗장 풀린 클라우드 오라클 구글 데이터센터 잇따라 가동,2.0
삼성SDS,2022-04-14,상장 초읽기 현대오토에버 시총 최소 조,2.0
삼성SDS,2022-04-19,올해 금융권 최대어 한화생명 억 차세대 발주 업계 경쟁,2.0
삼성SDS,2022-04-18,국내 클라우드 시장 긴잠서 기지개,2.0
삼성SDS,2022-04-20,반올림 발암물질 노출 삼성 연구원 백혈병 사망,2.0
삼성SDS,2022-04-21,디지털 인텔리전스 플랫폼 으로 글로벌 도약,2.0
삼성SDS,2022-04-25,분기 기업 실적 부진 우려가 현실로,2.0
삼성SDS,2022-04-26,억대 성과급 삼성 임원도 헷갈리는 인센티브,2.0
삼성SDS,2022-04-28,알립니다 매경 빅데이터 인공지능 포럼,4.0
삼성SDS,2022-04-29,노후자금 불려준다기에 수익 노리다 낭패,2.0
삼성SDS,2022-05-02,블록체인 클라우드 데이터경제로 가는 길 모색,2.0
삼성SDS,2022-06-03,불법야동 해외 불법사이트 무더기 차단,2.0
삼성SDS,2022-06-07,전문가 포럼 시대에 맞는 비즈니스 모델 발굴해야,2.0
삼성SDS,2022-06-09,키움증권 삼성전자 연계 공모,2.0
삼성SDS,2022-06-10,이사람 박종건 서큘러스 대표 매장 안내 노인 간호 로봇 일자리 더 늘어날 것,2.0
삼성SDS,2022-06-13,현대차 배당성향 % 위 전년대비 배 껑충 왜,0.0
삼성SDS,2022-06-15,키움증권 종 일까지 공모,2.0
삼성SDS,2022-06-14,삼성 블록체인 거래 가속 기술 공개,2.0
