company,date,title,rise
삼성SDS,2018-02-01,간추린 뉴스 단신 삼성 디지털 트랜스포메이션 리더 선포,2.0
삼성SDS,2018-02-05,삼성 작년 영업익 억 역대 최고,2.0
삼성SDS,2018-02-02,삼성 분기 실적 호조 매출 조 영업익 억원,0.0
삼성SDS,2018-02-06,삼성 영업익 억 % 늘어,0.0
삼성SDS,2018-02-07,열린세상 무엇에 쓰는 물건인고 유효상 차의과학대 경영대학원장,2.0
삼성SDS,2018-02-08,이재용 항소심 일 선고 승계작업 필요했나 삼성 특검 엇갈린 주장,2.0
삼성SDS,2018-02-09,주간증시전망 선 중립수준 흐름 수혜주 찾기 분주,0.0
삼성SDS,2018-02-12,주간증시전망 평창동계올림픽 이슈에 주목하라,2.0
삼성SDS,2018-02-13,급반등한 삼성그룹주,4.0
삼성SDS,2018-02-14,될성부른 장외주식 사다리역 톡톡 상장 후 대어 변신,2.0
삼성SDS,2018-02-19,삼성 춘천 데이터센터 착공,2.0
삼성SDS,2018-02-20,삼성 축구장 배 데이터센터 짓는다,0.0
삼성SDS,2018-02-21,삼성 춘천에 차세대 데이터센터,2.0
삼성SDS,2018-02-23,삼성 춘천에 데이터센터,4.0
삼성SDS,2018-02-26,삼성 춘천에 축구장 배 데이터센터,2.0
삼성SDS,2018-02-27,삼성 춘천 데이터센터 기공식 클라우드 사업 강화,2.0
삼성SDS,2018-03-02,시동 걸린 삼성 주주 사회적 책임 미래로 향한다,2.0
삼성SDS,2018-03-07,은행권 공동으로 신입직원 채용 매뉴얼 만든다,2.0
삼성SDS,2018-03-06,이코노 브리핑 경기장 내 현금 비자카드 결제만 가능,4.0
삼성SDS,2018-03-08,강력한 보안성 지닌 블록체인 글로벌 기업들 물류관리 등에 도입 나서,4.0
삼성SDS,2018-03-09,내달까지 변동장세 분할매수 대응을,2.0
삼성SDS,2018-03-12,급락장 투자손실 기관이 개미보다 더 아팠다,4.0
삼성SDS,2018-03-13,삼성 사내벤처로 사업 금맥,2.0
삼성SDS,2018-03-14,조 실적잔치 게임 포털 스몸비 는 나몰라라,2.0
삼성SDS,2018-03-19,외풍에도 잘 견디는 실적 우등생 찾아라,0.0
삼성SDS,2018-03-20,삼성 대 사장 시대,4.0
삼성SDS,2018-03-21,실속 베팅 하이닉스 삼성 집중 매수,2.0
삼성SDS,2018-03-22,삼성전자 설 맞아 협력사 물품대금 억 조기 지급,2.0
삼성SDS,2018-03-23,삼성전자 협력사에 설 물품대금 억원 조기 지급,0.0
삼성SDS,2018-03-26,삼성전자 설 맞아 협력사에 물품대금 억 조기 지급,2.0
삼성SDS,2018-03-27,삼성전자 설 맞아 협력사 농촌마을과 상생,4.0
삼성SDS,2018-03-28,삼성 설 앞두고 협력사에 천억 조기집행,0.0
삼성SDS,2018-03-30,삼성전자 협력사 물품대금 억 조기 지급,2.0
삼성SDS,2018-04-02,수백억 이상 배당금 받는 대기업 총수 이건희 억대 최고,2.0
삼성SDS,2018-04-03,톨게이트서 속도 안 늦추고 통행료 결제,2.0
삼성SDS,2018-04-04,조 매물 쏟아낸 외국인 낮은 종목은 샀다,0.0
삼성SDS,2018-04-06,삼성 전자계열사 협력사 물품대금 억 조기 지급,2.0
삼성SDS,2018-04-09,호암 탄생 주년 삼성 정중동 행보,2.0
삼성SDS,2018-04-10,삼성 삼성메디슨 통합 신수종 의료기기 키울까,2.0
삼성SDS,2018-04-11,박용채 칼럼 이재용의 좋은 모습,0.0
삼성SDS,2018-04-12,외국인 조 팔면서도 싼 종목은 샀다,2.0
삼성SDS,2018-04-13,보안이 생명 베일 속 클라우드 데이터센터,2.0
삼성SDS,2018-04-16,유리천장 얇아진 삼성 금융계열사 첫 여성 부사장 탄생,2.0
삼성SDS,2018-04-17,남북대화 모드에 현대그룹 대북사업으로 분위기 반전하나,2.0
삼성SDS,2018-04-18,아마존 에 이어 오라클도 클라우드 쟁탈전 가세 데이터센터 오픈,2.0
삼성SDS,2018-04-19,경제와 세상 억수로 운 좋은 사나이,0.0
삼성SDS,2018-04-20,삼성 체제 완성 뉴삼성 재시동,4.0
삼성SDS,2018-04-23,실적장세 온다 먼저 움직인 하이닉스 삼성 찜,2.0
삼성SDS,2018-04-24,미래 먹거리 빅데이터 문과생도 선택 아닌 필수,2.0
삼성SDS,2018-04-25,삼성 카이스트 빅데이터 분석 공동연구,2.0
삼성SDS,2018-04-26,삼성 빅데이터 분석 협력,2.0
삼성SDS,2018-04-27,삼성 빅데이터 분석 관련 산 학 협약,2.0
삼성SDS,2018-04-30,삼성 빅데이터 전문가 육성 맞손,2.0
삼성SDS,2018-05-02,브리핑 전자 에어컨 생산량 % 증가,0.0
삼성SDS,2018-05-03,확산되는 동반성장 삼성전자 설 연휴 이전에 물품대금 억 조기지급,2.0
삼성SDS,2018-05-04,단독 이학수 사면도 다스 소송비 대납 대가,0.0
삼성SDS,2018-05-08,샐러리맨의 패자부활전 솔루엠 대우루컴즈 에이치시티 날개 편다,0.0
삼성SDS,2018-05-09,간추린 뉴스 단신 삼성 경영대 빅데이터 협약,4.0
삼성SDS,2018-05-10,산업 인프라 될 블록체인 융복합 금융서비스 첨병,2.0
삼성SDS,2018-05-11,롯데쇼핑 등 실적 줄어도 통 큰 배당,2.0
삼성SDS,2018-05-14,블록체인 년 후 금융기관 절반으로 줄일 것 종합,2.0
삼성SDS,2018-05-15,배당 보너스 의 계절 쥐꼬리 배당 현금부자는,2.0
삼성SDS,2018-05-16,창의성 무장한 인재 어디 없나요,2.0
삼성SDS,2018-05-17,솔루션즈 작년 매출 억 돌파,2.0
삼성SDS,2018-05-18,삼성 잠실을 개발자 메카로,2.0
삼성SDS,2018-05-21,강력한 보안 바탕 공인인증 체계 확 바뀐다,2.0
삼성SDS,2018-05-23,이재용 경영 복귀보다 성찰의 시간 잠행 생각보다 길어질 듯,0.0
삼성SDS,2018-05-25,삼성 과 동반진출 글로벌 물류시장 공략,2.0
삼성SDS,2018-05-28,이해진 네이버 이사회서 빠진다,2.0
삼성SDS,2018-05-29,시론 블록체인이 가져올 새로운 무역 환경,2.0
삼성SDS,2018-05-30,전자정부 보안에 지능형 방어 시스템 만든다,0.0
삼성SDS,2018-05-31,이해진의 총수 꼬리표 떼기 관건은 영향력,2.0
삼성SDS,2018-06-05,주주친화 경영 확산 삼성물산 등 개사 배당금 %이상 늘려,4.0
삼성SDS,2018-06-04,창의성 키우기 나선 기업들 틀을 깨자 호칭 파괴 업무 발굴 셀프결재도,2.0
삼성SDS,2018-06-08,이범준의 저스티스 삼성과 법관,2.0
삼성SDS,2018-06-11,블록체인 전자문서 유통 시장 뒤흔든다,2.0
삼성SDS,2018-06-12,역대최대 보아오포럼 시진핑 메시지에 쏠린 눈,2.0
삼성SDS,2018-06-14,연구원 명 전원에 개인 연구실 인재들이 몰려왔다,2.0
삼성SDS,2018-06-15,삼성 블록체인 물류사업 확대,0.0
삼성SDS,2018-06-18,부터 블록체인까지 삼성 로 물류사업 확대,2.0
삼성SDS,2018-06-19,삼성 스마트 물류사업 확대,4.0
삼성SDS,2018-06-20,홍원표 삼성 대표 하루 걸렸던 판매량 예측 덕에 분이면 끝,2.0
삼성SDS,2018-06-21,왕의 귀환 삼성 그룹 펀드 뜬다,2.0
삼성SDS,2018-06-22,삼성 계열사들 난임 유급휴가제 신설,2.0
삼성SDS,2018-06-25,수요 분만에 정확히 예측 물류 유통 확 바꾼 첼로,4.0
삼성SDS,2018-06-26,블록체인 전도사 홍원표 판매수요 예측 로 분만에 해결,2.0
삼성SDS,2018-06-27,인공지능 블록체인 기술 접목 글로벌 물류 플랫폼으로 도약,2.0
삼성SDS,2018-06-28,어묵 코드 찍어봤더니 원산지서 매장 정보까지 쫙,2.0
삼성SDS,2018-06-29,가 재고 관리 의 스마트 물류,2.0
삼성SDS,2018-07-02,퀴어는 당신 옆에서 일하고 있다,2.0
삼성SDS,2018-07-03,삼성 차세대 나라장터 수주 맞붙는다,2.0
삼성SDS,2018-07-04,한화 상장 지배구조개선 해법 찾는다,2.0
삼성SDS,2018-07-05,과학향기 블록체인에는 비트코인만 있는 게 아니다,0.0
삼성SDS,2018-07-06,삼성그룹 상반기 공채 돌입,2.0
삼성SDS,2018-07-10,사설 스마트물류 블록체인 대표 모델로 육성해야,2.0
삼성SDS,2018-07-12,삼성 상반기 채용 규모 확대 삼성 삼성전기도 더 뽑는다,4.0
삼성SDS,2018-07-13,서비스 빅 차 산업혁명 신기술 경쟁 본격화,2.0
삼성SDS,2018-07-16,인재양성 에 신사업 강화 업계 상반기 채용 러시,2.0
삼성SDS,2018-07-17,헤지펀드 헤지펀더 그로쓰힐자산운용 롱숏 메자닌 삼색투자 년 수익률 최고 %,4.0
삼성SDS,2018-07-19,서비스 기업들 성장전략 핵심은 서비스 차별화,2.0
삼성SDS,2018-07-18,디지털 트랜스포메이션 시대 기술로 더 쉽고 빠르게,2.0
삼성SDS,2018-07-20,삼성 모바일 보안 녹스 고객사 편의성 잡은 업데이트,2.0
삼성SDS,2018-07-23,다시 태어나는 삼성 삼성 미전실 해체 년 계열사들 삼성전자 의존 줄었다,2.0
삼성SDS,2018-07-24,대우건설 층 최고층에 카페 전망대 춘천시 조망 가능,2.0
삼성SDS,2018-07-25,분양 현장 포커스 춘천 센트럴타워 푸르지오 춘천 최고 높이 층 프리미엄 주상복합,2.0
삼성SDS,2018-07-26,삼성 의료기 사업 내달 판교시대 시너지 가속,2.0
삼성SDS,2018-07-30,한국 데이터센터 개소 년 클라우드 매출 % 성장,2.0
삼성SDS,2018-07-27,한국 클라우드 서비스 매출 % 성장,2.0
삼성SDS,2018-07-31,클라우드 서비스 애저 한국 매출 년새 % 급증,2.0
삼성SDS,2018-08-02,미래 먹거리 클라우드 사업서 아마존 구글 국내시장 독식,2.0
삼성SDS,2018-08-03,한국 데이터센터 개소 년 클라우드 매출 배 상승,2.0
삼성SDS,2018-08-06,서경 하우징페어 대우건설 춘천 최고층 센트럴타워 푸르지오 지역 랜드마크 예약,2.0
삼성SDS,2018-08-07,출범 년 개월 만에 누적 거래대금 조 돌파,4.0
삼성SDS,2018-08-08,장외주식시장 년 개월 누적거래대금 조 돌파,4.0
삼성SDS,2018-08-09,삼성 나라장터 차세대 시스템 두고 격돌,2.0
삼성SDS,2018-08-10,삼성 전자계열사 일 주총데이 이사회 개혁 시동,2.0
삼성SDS,2018-08-13,격차 삼총사 올해도 실적 거침없네,2.0
삼성SDS,2018-08-14,차 산업혁명 시작 블록체인 중간유통 없애 비용절감 물량 재고관리 효율 강화,2.0
삼성SDS,2018-08-16,누적 거래대금 첫 조 돌파 시총은 년새 %,2.0
삼성SDS,2018-08-17,사이트 민정웅 로지스타 서밋 조직위원장 인하대 교수 기술과 정보의 이동 물류 혁신에 주목,2.0
삼성SDS,2018-08-21,서울 경기 경선 결선투표 가 판 흔들까,2.0
삼성SDS,2018-08-20,사장님의 퇴근 순찰 이후 칼퇴 눈치보기 사라졌다,2.0
삼성SDS,2018-08-23,밤샘 야근 잦은 업계 근로시간 단축 비상,2.0
삼성SDS,2018-08-24,서울시장 후보들 도시의 미래를 봤다 공약에 반영,2.0
삼성SDS,2018-08-27,차세대 형사사법시스템 수주 경쟁 스타트,2.0
삼성SDS,2018-08-28,삼성 블록체인 기반 전략사업 키운다,2.0
삼성SDS,2018-08-29,삼성 블록체인 기술 활용 플랫폼 확대,4.0
삼성SDS,2018-08-30,이사회 힘 실어준 삼성 사내이사 물러난 이해진,2.0
삼성SDS,2018-09-03,배당 풀고 이사회 권한 강화 주주에게 더 공손해진 주총,2.0
삼성SDS,2018-08-31,빅데이터 암호화 된 그대로 분석 개인정보 유출 원천차단,2.0
삼성SDS,2018-09-04,삼성전자 주총 이재용 불참 속 주주가치 제고 이사회 중심 책임 경영 강화,2.0
삼성SDS,2018-09-05,책으로 배우는 재테크 부동산 투자 잘하려면 시장 보는 통찰력 키워라,2.0
삼성SDS,2018-09-06,기업 시총 상승률 시장 평균보다 높아,2.0
삼성SDS,2018-09-07,한국 클라우드 시장 외국기업 잔치판 되나,2.0
삼성SDS,2018-09-11,이사회 중심 스피드 경영 본격화 삼성 년 기업 향해 다시 뛴다,2.0
삼성SDS,2018-09-10,삼성그룹주 펀드 내가 제일 잘나가,2.0
삼성SDS,2018-09-13,확 늘리고도 최대실적 괴력 삼총사,2.0
삼성SDS,2018-09-12,컴퍼니 인사이드 그룹 글로벌 경영 선봉장 역할 수익성 악화 개선이 과제,2.0
삼성SDS,2018-09-17,차 산업혁명 시작 블록체인 글로벌 표준화 정보 공유가 여는 상생 산업구도,2.0
삼성SDS,2018-09-14,파수닷컴 문서보안 넘어 문서관리 등 파수꾼,2.0
삼성SDS,2018-09-18,미래포럼 기술 활용한 플랫폼형 서비스 산업,2.0
삼성SDS,2018-09-19,막내 삼성바이오가 그룹시총 이끈다,2.0
삼성SDS,2018-09-20,삼성그룹 펀드 조정장서도 강했다,0.0
삼성SDS,2018-09-21,조달청 나라장터 차세대 사업 우선협상대상자로,0.0
삼성SDS,2018-09-27,가짜뉴스 경제적비용 조 민주주의 심각한 위기,2.0
삼성SDS,2018-09-28,중견 업계 영업이익률 %도 안된다,2.0
삼성SDS,2018-10-01,카카오 담는 블록체인 펀드 나온다,2.0
삼성SDS,2018-10-02,청약경쟁률 대 지방 분양 한파에도 돈되는 단지는 뜬다,2.0
삼성SDS,2018-10-04,클릭 신간 익스트림 팀 외 권,2.0
삼성SDS,2018-10-05,페북 찢기고 아마존 깨지고 담은 펀드 비실비실,2.0
삼성SDS,2018-10-08,흔들리는 윈스 시대가 온다,2.0
삼성SDS,2018-10-11,정유라 말 뇌물 안종범 수첩 증거 인정 이재용 심과 달라,0.0
삼성SDS,2018-10-12,이재용 귀국 최태원 출국,2.0
삼성SDS,2018-10-15,귀국한 이재용 부회장 일 이사회서 시동 걸까,2.0
삼성SDS,2018-10-16,골든파워 삼성을 이끄는 사람들,4.0
삼성SDS,2018-10-17,혁신성장 일자리 외쳤지만 서비스 기업 썰렁한 채용시장,2.0
삼성SDS,2018-10-18,이재용 뇌물 인정액 억 억 억 재판부 따라 엎치락뒤치락,2.0
삼성SDS,2018-10-22,보호무역주의 대항 보아오포럼 개막,2.0
삼성SDS,2018-10-23,삼성전기 화재 보유 물산지분도 매각 수순,0.0
삼성SDS,2018-10-24,화물전용 에어인천 기 첫 도입 삼성 물량 수송,2.0
삼성SDS,2018-10-25,스토리 삼성 미래 기대 지배구조 연결 대장주로 비전 담았나 과속인가,0.0
삼성SDS,2018-10-26,삼바춤 에 바이오 다시 춤추나,0.0
삼성SDS,2018-10-29,미래한국 교육에서 길을 찾다 코딩에 대한 막연한 두려움 없애 미래사회 이끌어갈 밀알 심어요,0.0
삼성SDS,2018-10-30,삼성 지배구조 개편에 물산 재조명,4.0
삼성SDS,2018-10-31,삼성물산 지분 전량 매각 삼성 순환출자 해소,4.0
삼성SDS,2018-11-01,주 시간 근무 업계 묘수는 탄력근무,0.0
삼성SDS,2018-11-02,로봇프로세스자동화 대형 서비스 업계도 진출 올해 확산 원년,4.0
삼성SDS,2018-11-05,한은 억 규모 차세대 시스템 수주 경쟁,0.0
삼성SDS,2018-11-06,한화 일감 몰아주기 해법 못찾는 한화,2.0
삼성SDS,2018-11-07,주중 한국기업 채용박람회 삼성 등 개기업 참여,2.0
삼성SDS,2018-11-08,상하이 주중 한국기업 채용박람회,2.0
삼성SDS,2018-11-09,이전상장 기업 주가가 궁금해 에 물어봐,2.0
삼성SDS,2018-11-12,부고 이옥만씨,2.0
삼성SDS,2018-11-13,부고 한정태 하나금융투자 기업분석실장 씨 부친상,0.0
삼성SDS,2018-11-14,삼성 지배구조개편 열쇠 쥔,0.0
삼성SDS,2018-11-16,삼성 블록체인 활용 글로벌 혁신 이끈다,2.0
삼성SDS,2018-11-15,삼성 하청 명 직고용 결단 의무 아니지만 요구 수용 미봉책 대신 파격 카드,2.0
삼성SDS,2018-11-19,굵직한 해운분야 분쟁 구조조정 뒤엔 언제나 광장이,4.0
삼성SDS,2018-11-20,가짜 마오타이 블록체인은 알고 있다,0.0
삼성SDS,2018-11-21,부고,2.0
삼성SDS,2018-11-22,삼성 현대차 지배개편 계열사간 합병설 재부상,0.0
삼성SDS,2018-11-23,판 커지는 차혁명펀드 한중일 연작 나온다,2.0
삼성SDS,2018-11-26,직토 글로벌 블록체인 연합 이더리움 기업 연합 가입,2.0
삼성SDS,2018-11-28,비상걸린 삼성전자 아웃소싱 으로 위기 넘는다,2.0
삼성SDS,2018-11-29,삼성,4.0
삼성SDS,2018-12-03,리포트 공정위 이어 금융위까지 압박 갈 길 없는 삼성,2.0
삼성SDS,2018-12-04,줄잇는 대형 사업 공공시장 훈풍분다,2.0
삼성SDS,2018-12-06,인터넷 새 먹거리 찾자 사업 공들이는 삼성,2.0
삼성SDS,2018-12-07,삼성 등 대기업 블록체인 속속 진출,2.0
삼성SDS,2018-12-10,대세는 하이브리드 클라우드 기업 총공세,2.0
삼성SDS,2018-12-11,현장 행정 동고동락 마당 벽을 허문 마포,2.0
삼성SDS,2018-12-13,차산업펀드 이어 블록체인 펀드 뜬다,4.0
삼성SDS,2018-12-14,금감원 지배구조 개선해야 삼성 연달아 흔드는 정부여당,0.0
삼성SDS,2018-12-17,블록체인 만난 은행 공인인증서 와 작별 준비,2.0
삼성SDS,2018-12-20,주식시장 불신에서 안심으로 키플레이어 기업 사관학교 로 거듭나는 장외시장,2.0
삼성SDS,2018-12-24,용어 표준화 클라우드 적용 차세대 병원정보시스템 공개,2.0
삼성SDS,2018-12-26,펀드줌인 한투운용 제 차산업혁명증권투자신탁,0.0
삼성SDS,2018-12-27,부고 이영의씨 별세,2.0
삼성SDS,2018-12-28,히다찌 정보자원관리원 보안 맡는다,4.0
삼성SDS,2019-01-02,삼성 영업익 % 홈쇼핑은 % 줄어,2.0
삼성SDS,2019-01-03,삼성 깜짝실적 순익 % 쑥 분기 실적발표,2.0
삼성SDS,2019-01-04,삼성 분기 영업익 % 늘어 억,2.0
삼성SDS,2019-01-07,삼성 분기 매출 조 억 % 늘어,2.0
삼성SDS,2019-01-08,홍원표 삼성 대표의 대 전략사업 꽃 피다,2.0
삼성SDS,2019-01-09,병원 기업 곳 뭉쳐 의료 개발한다,4.0
삼성SDS,2019-01-11,한국형 인공지능 정밀의료 프로젝트 닻올렸다,4.0
삼성SDS,2019-01-15,매경춘추 새 필진과 신록의 봄 맞으세요,2.0
삼성SDS,2019-01-14,총수 이재용 으로 바뀐 삼성 당장 큰 변화는 없을 듯,2.0
삼성SDS,2019-01-16,삼성전자가 암호화폐를 만든다고 삼성아틱 사기 주의보,2.0
삼성SDS,2019-01-17,순환출자 고리 해소 와중에 압박에만 몰두하는 당국,2.0
삼성SDS,2019-01-18,미리보는 서울포럼 코헨의 새로운 디지털 시대 혜안은 지식의 성찬 나눈다,2.0
삼성SDS,2019-01-21,삼성 지배구조 개편 길 막는 금융당국,2.0
삼성SDS,2019-01-22,이슈분석 금융권 블록체인 인증 채비 한창 표준 규격 마련은 과제,2.0
삼성SDS,2019-01-23,아리아종합건설 최첨단 친환경 시설로 고객 만족도 높여,2.0
삼성SDS,2019-01-24,삼성 한영 기업용 블록체인 융합 맞손,0.0
삼성SDS,2019-01-25,삼성 한영 블록체인 경쟁력 강화 협력,2.0
삼성SDS,2019-01-28,삼성바이오로직스 분식회계 논란 바이오로직스 지분 묶인 삼성물산 그룹 지배구조 재편작업 빨간불,2.0
삼성SDS,2019-01-29,재조명받는 정부 개 다리정책 수혜주는,2.0
삼성SDS,2019-01-30,중기 세계로 날다 아트토이 세계로 수출한다,2.0
삼성SDS,2019-01-31,장석권 한양대 경영대학장 규제 풀어 기업이 마음껏 뛰놀게 해야,2.0
삼성SDS,2019-02-01,무역도 디지털 트레이드 체인 으로 블록체인 시대 준비 나서는 무역협회,2.0
삼성SDS,2019-02-08,삼성증권 배당사고 후에야 회수 프로그램 만들었다,2.0
삼성SDS,2019-02-11,삼성증권 배당사고 직원 명 검찰 고발,2.0
삼성SDS,2019-02-12,금감원 유령주식 배당사고 삼성증권 직원 검찰고발 삼성 는 공정위 신고,2.0
삼성SDS,2019-02-13,금감원 배당사고 삼성증권 최대한 엄정 제재 매도직원은 검찰고발,4.0
삼성SDS,2019-02-14,삼성 조 유령주 사전인지 못하고 사후통제도 불능,2.0
삼성SDS,2019-02-15,사설 삼성증권 사건 구멍 난 내부통제 시스템 때문이라니,2.0
삼성SDS,2019-02-18,삼성증권 사태 위법 발견 엄정한 제재 불가피하다,2.0
삼성SDS,2019-02-19,내부통제 미비가 결국 배당사고 초래 위조주식 거래 가능한 통로 도 확인,2.0
삼성SDS,2019-02-20,하트시그널 시청중 출연자 이름 입력하면 해당 장면 찾아줘,4.0
삼성SDS,2019-02-21,서울포럼 코헨 전문가들과 디지털시대 미래상 그린다,2.0
삼성SDS,2019-02-22,유령주 고의 매도 명 고발 삼성 부당지원 의혹,2.0
삼성SDS,2019-02-25,금감원 삼성 일감 몰아주기 삼성과 충돌 심화,2.0
삼성SDS,2019-02-26,이건희 회장 와병 년 삼성의 명과 암 최대실적 최순실 사태,2.0
삼성SDS,2019-02-27,삼바 금감원 독립 갈등속 금융감독 수장 첫 만남,2.0
삼성SDS,2019-02-28,삼성 가상화 기업에 투자,2.0
삼성SDS,2019-03-04,삼성 미 가상화 업체에 투자,2.0
삼성SDS,2019-03-05,삼성 가상화 기업 비트퓨전 투자,2.0
삼성SDS,2019-03-06,삼성 가상화 기업 비트퓨전 에 투자,2.0
삼성SDS,2019-03-07,삼성증권 부당지원 입증 어렵다,0.0
삼성SDS,2019-03-08,이슈분석 뉴 삼성 전자 금융 투톱으로 지배구조 개편 속도,2.0
삼성SDS,2019-03-11,총수 일가 비주력 비상장 주식도 단계적으로 팔아라,2.0
삼성SDS,2019-03-12,간추린 뉴스 엠트론 부품사업 지분 매각,4.0
삼성SDS,2019-03-13,억 규모 세대 대기업 빗장 풀리나,2.0
삼성SDS,2019-03-14,제 인터넷 블록체인 개발 사업 탄력,2.0
삼성SDS,2019-03-15,차전지 생산설비 세계 최강,2.0
삼성SDS,2019-03-18,현금 조원 쌓아둔 삼성 회사채 만원 왜 발행했나,2.0
삼성SDS,2019-03-19,서비스업계 블록체인 신사업 속도전,2.0
삼성SDS,2019-03-20,불편한 공인인증 족쇄 풀린다 은행블록체인 인증사업 순항중,2.0
삼성SDS,2019-03-21,블록체인포럼 블록체인 금융 넘어 제조 유통 공공 인프라로 적용될 것,2.0
삼성SDS,2019-03-22,한승헌 한겨레 탄생은 기적 정세균 내일 비추는 언론 되길,2.0
삼성SDS,2019-03-25,차세대 전자정부 플랫폼 삼성 승부 펼치나,2.0
삼성SDS,2019-03-26,차 산업혁명 혁신의 주역 이 말한다,2.0
삼성SDS,2019-03-27,히트상품 비젠트로 중소 중견기업용 솔루션,2.0
삼성SDS,2019-03-28,삼성 클라우드 사업 대외로 넓힌다,4.0
삼성SDS,2019-03-29,삼성 국내 클라우드 시장 공략 나선다,2.0
삼성SDS,2019-04-01,삼성 멀티 클라우드 서비스 공개,2.0
삼성SDS,2019-04-02,삼성 클라우드 엔터프라이즈 공개 클라우드 대외 사업 본격 추진,2.0
삼성SDS,2019-04-03,홍원표 삼성 사장 클라우드 기회 있다 외부고객 유치 본격화,2.0
삼성SDS,2019-04-04,삼성 세계 최고 안전성 무기로 클라우드 시장 진출,2.0
삼성SDS,2019-04-05,삼성 멀티 클라우드 진출 신기술 공공사업 참여 의지,2.0
삼성SDS,2019-04-08,삼성 클라우드 대외사업 시동 맞춤형 서비스로 승부,2.0
삼성SDS,2019-04-10,계열사 서비스 경험 축적 지금이 적기 삼성 클라우드 시장 진출,2.0
삼성SDS,2019-04-11,홍원표 시스템 다운시간 연중 분내로,2.0
삼성SDS,2019-04-12,삼성 클라우드 사업 확대 연내 슈퍼컴퓨팅도 선보여,2.0
삼성SDS,2019-04-15,비즈,2.0
삼성SDS,2019-04-16,고성능 채굴기 만들어 블록체인 활성화 기여,2.0
삼성SDS,2019-04-18,단독 투자 조 미래 전쟁 대 기업 년새 억 더 썼다,2.0
삼성SDS,2019-04-19,국민연금 삼성계열사 투자 넘었다,0.0
삼성SDS,2019-04-22,생보업권 블록체인 플랫폼 최종 사업자 삼성,2.0
삼성SDS,2019-04-23,신임 지역정보개발원장 최종후보 이상은 지대범 압축,2.0
삼성SDS,2019-04-25,기자수첩 금융권 블록체인 성패 상호연동 에 달렸다,2.0
삼성SDS,2019-04-24,율촌 팀 개인정보보호 자문 선두 유럽 리스크 해결사로 나선다,2.0
삼성SDS,2019-04-26,부동산 파일 잠실 관광특구에 수요 많은 사보이시티잠실,2.0
삼성SDS,2019-04-29,은행권 블록체인 공동인증 명칭 뱅크사인 확정 수수료 원,2.0
삼성SDS,2019-04-30,삼성 국내 클라우드 시장 공략,2.0
삼성SDS,2019-05-02,은행권 공동 인증서 뱅크사인 월부터 발급된다,4.0
삼성SDS,2019-05-03,오늘의 부고 년 월 일,2.0
삼성SDS,2019-05-07,청소해 줘 한마디에 주인 말대로 움직이는 아파트,0.0
삼성SDS,2019-05-08,똑똑한 래미안 서초우성 부터 적용 협의한다,2.0
삼성SDS,2019-05-09,카카오 넷마블 롯데지주 조 이상 현금부자 합류,0.0
삼성SDS,2019-05-10,삼성 에 블록체인 협업 확대 러브콜,2.0
삼성SDS,2019-05-13,부터 물류 패션업계까지 여명 쫑긋,2.0
삼성SDS,2019-05-14,글로벌 명문대 비결은 신입생 선발 대학운영 자율권,2.0
삼성SDS,2019-05-15,출신 파워넷 흥행 수익률 호조 이어가나,2.0
삼성SDS,2019-05-16,인사이트 김종현 아주대 교수 블록체인은 혈관 암호화폐는 혈액,2.0
삼성SDS,2019-05-17,조 클럽 코앞인데 미만 주목,2.0
삼성SDS,2019-05-20,삼성 디지털금융 시장 공략 나선다,2.0
삼성SDS,2019-05-21,삼성 신개념 금융 폴랫폼 완성,2.0
삼성SDS,2019-05-22,삼성 블록체인 기반 금융 플랫폼 공개,2.0
삼성SDS,2019-05-23,삼성 블록체인 기반 디지털금융 본격화,2.0
삼성SDS,2019-05-24,삼성 블록체인 기반 금융플랫폼 넥스파이낸스 공개,2.0
삼성SDS,2019-05-27,블록체인 기반 금융 플랫폼 삼성 넥스파이낸스 공개,2.0
삼성SDS,2019-05-28,가 미래 경쟁력 삼성전자 세계적 인재 명 영입,2.0
삼성SDS,2019-05-29,홍원표 블록체인으로 디지털 금융 이끌겠다,2.0
삼성SDS,2019-05-30,세브란스 오픈 시장 진출 본격화,4.0
삼성SDS,2019-05-31,업계 시간 통신사 유연근무제 발빠른 도입 야근 많은 게임업체 난감,2.0
삼성SDS,2019-06-03,삼성 도 대리 과장 없앤다,4.0
삼성SDS,2019-06-04,삼성 디지털 금융사업 나섰다,2.0
삼성SDS,2019-06-05,삼성전자 최고혁신책임자 첫 임명 새로운 비전 만들 것,2.0
삼성SDS,2019-06-07,블록체인 기반 통합신분증 비서 보험상담 삼성 넥스파이낸스 쓸만해요,2.0
